,Job Title,Salary Estimate,Job Description,Rating,Company Name,Location,Size,Founded,Type of ownership,Industry,Sector,Revenue
22,Senior Data Scientist (2 openings),Employer Provided Salary:$180K - $205K,"SENIOR DATA SCIENTIST
Current is a leading U.S. fintech serving people who have been overlooked by traditional banks and one of the fastest growing companies with nearly 4 million members. Headquartered in NYC, our results-driven environment enables us to build better products, grow faster and empower everyone on our team to have an impact on our business and our mission to improve financial outcomes for our members.
RESPONSIBILITIES
Conduct in-depth analyses to improve product growth, engagement, retention, and revenue.
Help drive a more robust product strategy through detailed predictive modeling and market analysis.
Track and analyze member behavior to provide insights that help align marketing, product, customer success and finance.
Provide data driven recommendations to maintain and improve team KPIs.
Present performance, engagement insights and recommendations to the whole company.
Collaborate with Engineering groups to define and build new data infrastructure.
REQUIREMENTS
Master's degree in Computer Science, Data Science, Statistics, Mathematics, Economics or related field;
24 months of experience as Data Scientist/ Data Quantitative Analyst or related;
Proficient with software skills of SQL and Python.
This role has a base salary range of $180,000 - $205,000. Current offers a competitive total rewards package which includes base salary, equity, and comprehensive benefits.
BENEFITS
:
Competitive salary
Meaningful equity in the form of stock options
401(k) plan
Discretionary performance bonus program
Biannual performance reviews
Medical, Dental and Vision premiums covered at 100% for you and your dependents
Flexible time off and paid holidays
Generous parental leave policy
Commuter benefits
Fitness benefits
Healthcare and Dependent care FSA benefit
Employee Assistance Programs focused on mental health
Healthcare advocacy program for all employees
Access to mental health apps
Team building activities
Our modern Chelsea-based office with open floor plan, stocked kitchen, and catered lunches

JOB ID# SDS0515",4.2,"current
4.2","New York, NY",1 to 50 Employees,2015,Company - Private,Banking & Lending,Financial Services,Unknown / Non-Applicable
23,Sr. Business Data Analyst,Employer Provided Salary:$70.00 - $75.00 Per Hour,"We are actively looking #Lead Business Data Analyst – W2
Senior Lead Business Data Analyst
Only taking USC, GC or H4 EAD, L2 Visa or TN Visa
HYBRID IN THE OFFICE (2-3 DAYS/WEEK) UNLESS REMOTE IS NOTED
New York, NY, Charlotte, NC, Phoenix, AZ or Dallas, TX – hybrid onsite 3 days/week
4+ months – with extensions
Must have 7+ years – this is a high level senior data consultant who can work across teams/execs and c-level
MUST BE CONSULTANT LEVEL/SENIOR – this person will be engaging across teams providing data analyst support
7+ years of Business Data Analyst experience with C-Level, Executive partnering
This is a Senior Lead consultant who brings experience in the following areas:
Conduct data analysis and review of Regulatory & Basel reporting requirements
Provide metrics for senior management highlighting key risks/issues and implementation status and progress on strategic initiatives.
Create Senior Management ready materials, including presentations to key stakeholders across the organization.
Coordinate across Risk/Technology/Data Management teams to understand current data sources, and gaps requiring resolution/automation
Work closely with Technology to develop implementation plans using an Agile methodology and execute them in Scrum teams
Identify key decision areas; perform research around potential alternatives
Provide testing and review support throughout implementations
Thanks & Regards
Pinki Kumari
Technical Recruiter
Desk No: +1- 4698071673
Email: pinki@anveta.com| URL: http://www.anveta.com
Address: 1333 Corporate Drive, Suite #108 Irving, TX 75038, USA
Job Type: Contract
Salary: $70.00 - $75.00 per hour
Expected hours: 40 per week
Ability to commute/relocate:
New York, NY 10001: Reliably commute or planning to relocate before starting work (Required)
Experience:
Business Data Analyst: 10 years (Preferred)
Work Location: In person",-1,NAVETA AG,"New York, NY",51 to 200 Employees,-1,Company - Public,-1,-1,Unknown / Non-Applicable
24,Data Scientist,Employer Provided Salary:$90K - $120K,"Are you passionate about finding insights from data and using them to drive client and business decisions? Do you have a strong background in mathematics, statistics, project controls, and programming? If so, Matrix New World is looking for a qualified and experienced Data Scientist and this may be the perfect fit for the next step in your career! We have offices in AZ, LA, NJ, NY and CT so the ideal candidate will determine where the position sits.
As a Data Scientist at Matrix, you will work with various teams across the organization to collect, analyze, and interpret large and complex data sets. You will use your skills in data mining, modeling, and data visualization to provide actionable recommendations and solutions for various business problems utilizing software tools including Power BI, Excel, and the other applications from the Microsoft Office suite. You will also communicate your findings and insights to both technical and non-technical audiences. You will join a growing team focused on exciting projects in the sustainability, engineering, geospatial, industrial, and environmental fields. This role is primarily focused on supporting client projects in both the public and private space.
Responsibilities for this position include, but are not limited to:
Perform business analysis duties at an intermediate level
Identify trends, patterns, and anomalies found in big data sets by performing extensive data analysis to develop insights
Performing data mining, cleaning, and aggregation processes to prepare data, implement data models, conduct analysis, and develop databases
Interpreting results from multiple structured and unstructured data sources using programming, statistical, and analytical techniques and tools
Collaborate with teams to understand each data analysis projects' underlying purpose, focus, and objectives
Design, develop, and implement the most valuable data-driven solutions for Matrix.
Field, interpret, and develop solutions to internal and external client requests
Assist with development of interpretive graphics and reports on client facing projects
To be successful in this role, you should have:
3-5 years of proven experience as a Data Scientist, Data Analyst or a similar role in a data-driven environment
A Bachelor's or higher in statistics, mathematics, computer science, engineering, or a related field
Certification in Microsoft Data Management and Analytics
Strong experience in designing and developing dashboards and reports using data visualization tools such as Power BI, Excel and other data visualization tools
Excellent communication and presentation skills with the ability to explain complex concepts in simple terms
Strong problem-solving and critical thinking skills with the ability to work independently and collaboratively
A curious and creative mindset with a passion for learning new things and exploring new possibilities
Matrix is an Equal Opportunity Employer and will consider all qualified applicants for employment without regard to race, color, religion, sex, sexual orientation, gender identity, national origin, disability, or status as a protected veteran. We offer a competitive salary, commensurate with experience, along with a pleasant and professional work environment.
Annual Salary Range: $90k - $120k
We offer excellent benefits including:
Medical/Rx Insurance
Dental Insurance
Vision Insurance
Flexible Spending Account
401(k) plan with company match
Paid Holidays
Paid Time Off
Company-paid Life Insurance
Supplemental Life Insurance
Company-paid Long-Term Disability Insurance
Please note: This position is not eligible for an employment visa sponsorship (e.g.H1-B, etc.).",4.0,"Matrix New World Engineering
4.0",Remote,51 to 200 Employees,1990,Company - Private,Architectural & Engineering Services,"Construction, Repair & Maintenance Services",$25 to $100 million (USD)
25,Data Scientist,$74K - $105K (Glassdoor est.),"At Imagine we go beyond print to help our clients deliver game-changing visual communications from concept to delivery that set the standard for our industry. The first step in this process is hiring great employees! Our innovative teams are the most committed, highly experienced artisans in the business. We are committed to delivering high-quality marketing solutions, in every environment and campaign, helping our clients capture the heart, minds, and loyalty of their customers. For more than 30 years, The Imagine Group has established itself as one of the most influential and innovative visual communications companies in the industry. Join us and let’s Imagine a better way together.
Candidates for this position must be local to the Minneapolis, St. Paul Area. This is a Hybrid role requiring 2-3 days onsite at our offices in Shakopee, MN.
Position Summary:
As a Data Scientist, you will contribute to Imagine’s objectives by delivering rapid and scalable solutions within our operations. You will do this by designing, implementing, and deploying data visualizations & business intelligence, and insights & analytics for a broad range of business objectives.
Essential Functions and Responsibilities:
Develop, plan, and execute analytical projects as an individual contributor and in teams
Delivery focused: Help design analytical and technical solutions using a rigorous hypothesis-based approach, partner with technical teams to build a development plan, and then help execute the development and implementation with a focus on high-impact return
Agile and pragmatic: Ability to rapidly deliver results in high pressured projects with the skill to pivot quickly with iterative, POC, or agile methods
Contemporary and innovative approach: ability to develop novel solutions using modern platforms (e.g., Cloud based platforms like Azure, AWS), languages/technologies (e.g., Python, Spark, SQL), and tools (e.g., Power BI, Selenium, UIPath)
Process Automation: Ability to understand a business process directly from a user, select and present an appropriate solution (e.g. RPA, API integration, simple macro-like script), develop and deliver solution, while considering value metrics to ensure results.
Structured approach: Bring order to disparate requirements with high tolerance for ambiguity, very strong problem solving ability, and excellent client engagement skills
Synthesize analytical findings for consumption by senior business executives
Communicator: Ability to break down complex structures and problems into succinct components for a range of clients and colleagues at all levels of seniority
Storytelling: Be a storyteller capable of delivering practical data insights in a compelling manner (e.g., via presentations/dashboards) actionable by senior leadership
Become trusted advisor and thought leader on business data and analytical techniques
Technology polymath: experience with a wide range of technology and can learn and develop any solutions across the full data science lifecycle and application stack
Test & Learn mentality: Challenge our current best thinking, test theories, evaluate feature concepts and iterate rapidly
Creativity: Invent creative ways to answer key business questions by leveraging existing data assets or creating new ones
Trusted voice: Establish and manage relationships with partners
Subject matter expertise: Develop deep subject matter expertise across techniques, technologies, and industries
Mandatory Qualifications:
Bachelors Degree in Mathematics, Engineering, Statistics, Computer Science or Physics
3-5 years of experience
Business Intelligence platform experience, such as PowerBI, Qlik, Tableau etc.
Ability to write efficient and robust queries in SQL.
Experience working with APIs for integration, as well as Selenium and other process automation or QA tools.
Experience of work in collaborative development environment (GIT, Azure DevOps, JIRA).
Exceptional intellectual curiosity
Exceptional problem solving ability
Ability to present ideas and solutions in business-friendly and user-friendly language to colleagues, management and clients.
Entrepreneurial, creative self-starter; able to work independently with limited direction
Preferred Qualifications:
Advanced Degree
Ability to write algorithms and implement pipelines in Python. Knowledge of Scala, or R.
Familiarity with various relational database platforms (SQL Server, MySql, PostgreSQL, Oracle, Snowflake, Vertica, etc).
Experience of work in cloud environments, especially MS Azure
Solid knowledge of statistics (e.g., hypothesis testing, probability distributions), machine learning (e.g., regression, regularization, PCA, random forest, XGBoost, deep learning, clustering), and other data science techniques (e.g., time series analysis, NLP, computer vision, mathematical optimization).
Imagine is an equal opportunity employer and does not discriminate based on race, religion, color, national origin, gender, sexual orientation, age, marital status, veteran status, or disability status. Diversity and Inclusion is not just a checked box, it is a critical part of our commitment to deliver innovative solutions to our clients and provide a great place to work for our entire Imagine family. We are focused on building a diverse and inclusive workforce. If you are excited about this role, but do not meet 100% of the qualifications listed above, we encourage you to apply.
#Li-LBH",3.9,"The Imagine Group, LLC
3.9","Shakopee, MN",1001 to 5000 Employees,1988,Company - Private,Advertising & Public Relations,Media & Communication,Unknown / Non-Applicable
26,"Data Scientist, People Data & Insights",Employer Provided Salary:$102K - $163K,"Johnson & Johnson Services Inc. is seeking a Data Scientist, People and Data Analytics with a primary location in New Brunswick, NJ. Remote work options may be considered on a case-by-case basis and if approved by the Company.
Caring for the world, one person at a time has inspired and united the people of Johnson & Johnson for over 130 years. We embrace research and science - bringing innovative ideas, products and services to advance the health and well-being of people.
With $94.9 Billion in 2022 sales, Johnson & Johnson is the world's most comprehensive and broadly-based manufacturer of health care products, as well as a provider of related services, for the consumer, pharmaceutical, and medical devices markets. There are more than 260 Johnson & Johnson operating companies employing over 135,000 people and with products touching the lives of over a billion people every day, throughout the world. If you have the talent and desire to touch the world, Johnson & Johnson has the career opportunities to help make it happen.
Thriving on a diverse company culture, celebrating the uniqueness of our employees and committed to inclusion. Proud to be an equal opportunity employer.
The Workforce Analytics team at Johnson & Johnson provides the insights and perspective on our employees and workforce that allow us to fulfill our mission of helping people everywhere live longer, healthier, happier lives.
This position is a fulltime fixed-term project with a scheduled end date of June 2025.
As a Data Scientist with Workforce Analytics, you will partner closely with HR and business stakeholders to apply algorithms and data science methods to address critical questions about our workforce. You will work with a variety of internal and external partners to help ensure that our investment in people aligns with the overall strategy of our organization. Your contributions will help ensure we continue to grow the rich culture and workplace that inspire the people of Johnson & Johnson.
In this role, you will be working as part of the Data Science team within Workforce Analytics to:
Power the data science product strategy by programming and developing applications and new data science products as well as enhancements to existing products.
Extract, sanitize and leverage large amounts of data from our central HR Data Hub to deploy data science solutions at scale.
Keep up to date on the leading edge of data mining and machine learning research by doing novel studies and keeping apprised with industry research/practices.
Translate key business questions to conceive, design, develop, and execute analytical solutions, including developing requirements, gathering/processing/analyzing data, and delivering insights through various channels (presentations, applications, other content).
Participate in project teams comprised of internal and external team members.
Elicit needs and act in a primary role as a trusted business and analytical partner.
Serve as part of a dynamic team with success hinging on effective collaboration with other team members.
Work with large, complex data sets demonstrating extraordinary judgment and discretion when dealing with highly sensitive people data.
Make business recommendations by delivering effective presentations of findings through effective visual displays of quantitative and qualitative information.
Qualifications
Master’s degree in computer science, Mathematics, Statistics, Machine Learning, Artificial Intelligence or other related discipline is required.
Minimum of 2 years experience with programming and application development using Python.
Minimum of 2 years experience applying predictive modeling techniques such as ML, decision trees, ensemble learning, neural networks etc., and data transformation such as text mining, fuzzy matching, etc.
A deep understanding of modern machine learning techniques/algorithms and their mathematical foundations to apply and tailor as necessary to include supervised, unsupervised, and semi-supervised learning methods is required.
Understanding of applied statistics (e.g., advanced statistical analysis, underlying assumptions of statistical modeling, interpretation of statistical results) and know which methods are most appropriate for a given research problem is required.
Ability to translate technical findings to non-technical audience.
Strong interpersonal and communication skills (written and verbal).
Experience working with human resources/people data is a plus.
This position will be primarily located in New Brunswick, NJ with up to 5% domestic travel required. Flexible work arrangements available as appropriate.
For more information on how we support the whole health of our employees throughout their wellness, career and life journey, please visit www.careers.jnj.com .
Johnson & Johnson is an Affirmative Action and Equal Opportunity Employer. All qualified applicants will receive consideration for employment without regard to race, color, religion, sex, sexual orientation, gender identity, age, national origin, or protected veteran status and will not be discriminated against on the basis of disability.
The base pay range for this position is $102,000 - $163,300.
The Company maintains highly competitive, performance-based compensation programs. Under current guidelines, this position is eligible for an annual performance bonus in accordance with the terms of the applicable plan. The annual performance bonus is a cash bonus intended to provide an incentive to achieve annual targeted results by rewarding for individual and the corporation’s performance over a calendar/ performance year. Bonuses are awarded at the Company’s discretion on an individual basis.
Employees may be eligible to participate in Company employee benefit programs such as health insurance, savings plan, pension plan, disability plan, vacation pay, sick time, holiday pay, and work, personal and family time off in accordance with the terms of the applicable plans. For additional general information on company benefits, please go to: https://www.careers.jnj.com/employee-benefits",4.2,"Johnson & Johnson
4.2","New Brunswick, NJ",10000+ Employees,1887,Company - Public,Biotech & Pharmaceuticals,Pharmaceutical & Biotechnology,$10+ billion (USD)
27,Machine Learning Engineer,$97K - $139K (Glassdoor est.),"Type: W2 Inc Description:
Role: Machine Learning Engineer
Location: Sunnyvale CA(Candidate must be local or willing to relocate upon offer, NO REMOTE)
Terms:12 mos+
W2/C2C resumes to msachdeva@sisinc.com
Our direct Tech giant client is looking for a Machine Learning Engineer for Sunnyvale, CA .

Skill Sets Niche Skill Experience Preference
Machine Learning Yes At least 1 year Is Required
Natural Language Processing No At least 1 year Is Required
python No At least 1 year Is Required
Location Sunnyvale , CA Min Experience (yrs): Required Education: Not Specified Benefits:",3.6,"SIS
3.6","Sunnyvale, CA",Unknown,1990,Company - Private,Information Technology Support Services,Information Technology,$5 to $25 million (USD)
28,People Analytics - Data Science & Reporting Analyst,Employer Provided Salary:$115K - $175K,"Join our Human Capital team in New York
The D. E. Shaw group seeks a data science and reporting analyst to join its Human Capital Analytics and Products (HCAP) team. Members of HCAP are curators of employee data and leverage it to help answer strategic and operational talent questions for leaders across the business. This role offers the opportunity to work in an inclusive, engaging, and collaborative working environment.
News
Library
Contact
What you’ll do day-to-day
You’ll help develop and build reporting solutions in new and existing tools to expand HCAP’s on-demand analytics portfolio and be responsible for building reports in a variety of tools (e.g., Python, Power BI). You’ll also have the opportunity to develop ETL pipelines, leadership-facing dashboards, and reporting products from the ground up.

Who we’re looking for
Applicants will have a bachelor’s degree or higher and two to five years of relevant work experience working in an early career data science, data engineering, or BI analyst setting.
Proficiency in using Python for data retrieval/transformation and interactive dashboard design is required.
This person should have a passion for data wrangling and an eye for applying data visualization best practices to high-quality reporting products.
Willingness to dive into details, collaborate effectively with teammates, and drive projects to completion is of the utmost importance. The ability to exercise extreme discretion with confidential information is also essential.
An advanced working knowledge of Excel is also desired, as is experience with business intelligence programs (e.g., Power BI, Tableau).
Individuals who possess a dedicated customer service mentality, excellent interpersonal communication skills, an ability to see how small details impact the bigger picture, and a knack for rapid problem solving are highly sought after.
People analytics experience is preferred but not required.
The expected annual base salary for this position is $115,000 to $175,000. Our compensation and benefits package includes variable compensation in the form of a year-end bonus, guaranteed in the first year of hire, and benefits including medical and prescription drug coverage, 401k contribution matching, wellness reimbursement, family building benefits, and a charitable gift match program.
At the D. E. Shaw group, we believe the diversity of our employees is core to our strength and success. We are committed to supporting our people in work and in life, which is why we offer benefits such as a family planning and surrogacy program and a charitable gift match to all full-time employees.
Additionally, our staff-led affinity groups are pillars of our community, helping to celebrate diversity, promote leadership and development opportunities, and facilitate inclusive mentorship. Members and allies organize a wide range of educational and social programming, from expert talks to film festivals.",4.6,"D. E. Shaw & Co., L.P.
4.6","New York, NY",1001 to 5000 Employees,1988,Company - Private,Investment & Asset Management,Financial Services,Unknown / Non-Applicable
