,Job Title,Salary Estimate,Job Description,Rating,Company Name,Location,Size,Founded,Type of ownership,Industry,Sector,Revenue
0,Data Engineer,Employer Provided Salary:$175K - $200K,"At Expa we're dedicated to being the best place for entrepreneurs to create and build companies. Expa was founded in 2013 by Uber co-founder Garrett Camp to help bring great ideas to life. We're builders, founders, and operators ourselves, know the struggles that come with starting a new company, and what it takes to succeed. We support entrepreneurs with more than just funding — we offer a valuable network, office space, and our advice and expertise. Expa Studio combines technical and design expertise, operational support, and capital to turn bold ideas into category-defining companies.
Your role
You will be a Data Engineer (ML, AI) at a new studio company tasked with building or leveraging machine learning solutions and developing applications utilizing AI frameworks and methods. This position will require you to design and collaborate with members across the organization to deliver product innovations leveraging your unique knowledge and skill set in Machine Learning and Artificial Intelligence in our Big Data Platform. You are required to use advanced programming and analytical skills to solve a variety of complex business problems across multiple industries and through all phases of the business lifecycle.
Your Responsibilities
Write and test product or system development code.
Participate in, or lead design reviews with peers and stakeholders to decide amongst available technologies.
Review code developed by other developers and provide feedback to ensure best practices (e.g., style guidelines, checking code in, accuracy, testability, and efficiency).
Contribute to existing documentation or educational content and adapt content based on product/program updates and user feedback.
Triage product or system issues and debug/track/resolve by analyzing the sources of issues and the impact on hardware, network, or service operations and quality.
Your Experience
Masters or PhD required, preferably in Statistics, Mathematics, Computer Science or related fields.
Minimum of 4+ years related experience, preferably in Financial Services.
Strong knowledge of statistical analysis software / data analysis experience including data manipulation; preferably Python, PySpark and R.
Proven track record in executing complex modeling/machine learning projects and new product development from concept to final delivery.
Expert analytical skills to evaluate, understand and interpret data.
Demonstrated ability to communicate ideas and analysis results effectively both verbally and in writing to technical and non-technical audiences.
Excellent communication, organization, interpersonal and presentation skills.
Demonstrated ability to simultaneously manage multiple projects of significant complexity.
This will be a full-time position with a salary range of $175,000-$200,000, which is determined by various factors, including, but not limited to, work experience, skills, location, depth and maturity of our project. We're open to remote work, but would prefer someone in the LA area so that we can work in person. We're a small team and we want to try to spend as much time iterating in these early days of the idea.",3.7,"Expa
3.7","Los Angeles, CA",1 to 50 Employees,2013,Company - Private,Business Consulting,Management & Consulting,Unknown / Non-Applicable
1,Data Scientist/Data Engineer - Economic Research,Employer Provided Salary:$121K - $151K,"Why Glassdoor?
Our mission is to help people everywhere find a job and company they love. In the process, we're transforming the workplace experience through the power of transparency and further cementing ourselves as the worldwide leader in employer branding and insights. By choosing a career at Glassdoor, you'll be directly contributing toward our vision for a world where transparency empowers the workforce and motivates companies to become better employers.
Please note: This role may be open to remote hiring. Our office locations are in San Francisco, CA; Chicago, IL; London, UK; and Dublin, Ireland.

About the Role
As a member of the Glassdoor Economic Research team, you will develop and own key public-facing data products, act as the go-to expert on Glassdoor data for our Economic Research team, and conduct original research in close collaboration with Glassdoor's Chief Economist and Lead Economist. This role will work deep in Glassdoor's proprietary data to share scalable insights on workplace communities, employee satisfaction, and the jobs market.
What You'll Do
Your day-to-day responsibilities will include analysis, development, and research using proprietary data to support Glassdoor Economic Research initiatives. Responsibilities and examples of projects may include:
Developing and maintaining a new public-facing data product using Glassdoor data to highlight a topical labor market or workplace trend. Building models in Python or R to support these data products.
Managing the data collection process for Glassdoor's annual Best Places to Work award.
Proposing and making improvements to the methodology and infrastructure for Glassdoor's data-driven awards.
Building dashboards, data sources, and tools that make data more accessible to support readers and/or internal teams.
Writing SQL queries to answer ad hoc media questions about Glassdoor's salaries or ratings data from top-tier media publications.
Working with product and engineering partners to understand what data is available, its definitions and limitations, and how to access it.
The role will primarily focus on developing, maintaining, visualizing and owning internal- & public-facing data products (approximately 70% of time) and 30% independent or collaborative research or support for data requests from internal stakeholders.
What You'll Bring
A commitment to add to our culture of DEI.
2-5 years of experience in a related field like data science, data engineering, decision science, or economics.
Excellent data fluency, including expertise with SQL.
Experience building ETL pipelines and/or deploying production-ready data products.
Strong experience with programming and data analysis using Python (preferred) and/or R. Writes clear, documented, and reproducible code.
Ability to work cross-functionally with product, engineering, and communications partners.
Nice to have: Demonstrated experience with statistics and applied econometrics.
Nice to have: Knowledge of data visualization tools like ggplot2, Tableau, R Shiny, or D3.js.
Compensation and Benefits
Base Salary Range: $120,500 - $150,600
You can learn more about our compensation philosophy here and see salary ranges for all Glassdoor jobs here.
Glassdoor base salaries are targeted to the market 75th percentile for technical roles and the 65th percentile for non-technical roles. In other words, 65-75% of comparable organizations in our industry will pay less.
Annual Bonus Target: 10%
**Bonuses are paid in 6-month intervals, aligning with bi-annual performance reviews
Generous Restricted Stock Units (RSU):
***Restricted Stock Units (RSU) are awarded at hire and may be refreshed annually. Additionally, as a pay-for-performance company, RSU grant awards are presented bi-annually to exceptional performers.
Health and Wellness: 100% employer-paid premiums for employee medical, dental, vision, life, short and long-term disability, select well-being programs, and 80% employer-paid premiums for all dependents.* Generous paid time off programs for birthing and non-birthing parents are provided, along with paid injury/illness leave and paid family emergency leave.
Coverage begins at the start of employment. After 48 months of continuous employment, 100% of all premiums for you and your dependents can be employer-paid!
Work/Life Balance: Open Paid Time Off policy, in addition to 15-20 paid company holidays/year
Investing in Your Future: 401(k) plan with a company match up to $5,000 per year, subsidized fertility and family planning services, and discounted legal assistance services.
Our Company Values and Commitments
Transparency: We are open and honest. We share information – the good and the bad – so we can continuously learn, collaborate and make the right decisions. Pay bands and our compensation philosophy are shared publicly.
Innovation: We actively pursue new and different ways to further Glassdoor's mission. We forge our own path by challenging the status quo. The ultimate goal is not just to change how we operate at Glassdoor, but for every employer to follow our lead!
Good People: We work together with integrity, respect and compassion for one another. We have fun together! We are inclusive, fair and humble while remaining confident. We do the right thing, period.
Grit: We are resilient, inventive and fearless. We see challenges as opportunities. With passion and courage, we come together to get the job done.
Diversity, Equity, and Inclusion: We are dedicated to building a company that is more diverse and representative of society at large. Glassdoor externally publishes our Diversity & Inclusion report and information about our employee population to hold ourselves accountable to our dedication. We also provide programs and resources to build a greater sense of belonging for our employees.
Glassdoor is committed to equal treatment and opportunity in all aspects of recruitment, selection, and employment without regard to race, color, religion, national origin, ethnicity, age, sex, marital status, physical or mental disability, gender identity, sexual orientation, veteran or military status, or any other category protected under the law. Glassdoor is an equal opportunity employer; committed to creating a community of inclusion, and an environment free from discrimination, harassment, and retaliation.
Our Company Values and Commitments
Transparency: We are open and honest. We share information – the good and the bad – so we can continuously learn, collaborate and make the right decisions. Pay bands, our compensation philosophy, and employee feedback polls are shared publicly.
Innovation: We actively pursue new and different ways to further Glassdoor's mission. We forge our own path by challenging the status quo. The ultimate goal is not just to change how we operate at Glassdoor, but for every employer to follow our lead!
Good People: We work together with integrity, respect and compassion for one another. We have fun together! We are inclusive, fair and humble while remaining confident. We do the right thing, period.
Grit: We are resilient, inventive and fearless. We see challenges as opportunities. With passion and courage, we come together to get the job done.
Diversity, Equity, and Inclusion: We are dedicated to building a company that is more diverse and representative of society at large. Glassdoor externally publishes our Diversity & Inclusion report and information about our employee population to hold ourselves accountable to our dedication. We also provide programs and resources to build a greater sense of belonging for our employees.
Glassdoor is committed to equal treatment and opportunity in all aspects of recruitment, selection, and employment without regard to race, color, religion, national origin, ethnicity, age, sex, marital status, physical or mental disability, gender identity, sexual orientation, veteran or military status, or any other category protected under the law. Glassdoor is an equal opportunity employer; committed to creating a community of inclusion, and an environment free from discrimination, harassment, and retaliation.",4.3,"Glassdoor
4.3","Chicago, IL",501 to 1000 Employees,2007,Company - Private,Internet & Web Services,Information Technology,Unknown / Non-Applicable
2,Data Engineer,-1,"Job Details
Description
CivicPlus is a trusted technology company dedicated to empowering government staff and powering exceptional digital experiences for residents. With a comprehensive suite of solutions that combine to form THE Modern Civic Experience Platform, we strive to create one-stop, frictionless, interactions that delight residents and help staff collaborate and work efficiently. As a result, government administrations that choose CivicPlus realize greater trust and satisfaction among their community members.
Backed by over 25 years of experience and leveraging the insights of more than 950 team members, our solutions are chosen by over 12,500 global entities and are used daily by over 340 million people in the U.S. and Canada alone.
As a Data Engineer within our AI and ML Team, you will play a crucial role in developing and maintaining the infrastructure required for the successful implementation of artificial intelligence (AI) and machine learning (ML) projects. Your expertise in data engineering will be instrumental in ensuring the availability, reliability, and scalability of data pipelines, enabling efficient data processing, analysis, and model training.
We’re excited to hire a new Data Engineer who can:
Design, develop, and maintain data infrastructure and pipelines to support AI and ML initiatives.
Collaborate with software engineers to understand data requirements and implement efficient data processing workflows.
Build and optimize data integration and transformation processes for structured and unstructured data sources.
Create and manage data warehouses, data lakes, and other storage systems to support large-scale data processing and analysis.
Ensure data security and privacy compliance in alignment with organizational and regulatory requirements.
Develop and maintain documentation related to data infrastructure, pipelines, and processes.
Collaborate with cross-functional teams to identify and address data-related challenges and opportunities.
May participate in on-call rotation to gain better understanding of Product Suite
There is no perfect candidate, but we are looking for:
Bachelor's degree in computer science, engineering, or a related field.
Proven experience as a Data Engineer or similar role, working with large-scale data processing and analysis.
Proficiency in SQL and experience with relational databases (e.g., PostgreSQL, MySQL) and NoSQL databases (e.g., MongoDB, Cassandra).
Experience with big data technologies and frameworks
Familiarity with cloud platforms (e.g., AWS, Azure, GCP) and their data-related services.
Knowledge of data modeling and ETL principles.
Understanding of distributed computing architectures and parallel processing techniques.
Excellent problem-solving skills and ability to work effectively in a dynamic team environment.
Strong communication and interpersonal skills, with the ability to explain technical concepts to non-technical stakeholders.
Note: We know that excellent candidates can have all sorts of backgrounds and experiences, so please don’t hesitate to apply even if you don’t meet 100% of the listed requirements!
We offer competitive salary and benefits packages, including health insurance, retirement plans, flexible time off, and a commitment to Diversity, Equity, Inclusion, and Belonging. If you are passionate about technology and want to make a meaningful impact in your community, we’d love to hear from you.
We are an equal opportunity employer and value diversity at our company. We desire to have our employees reflect the diverse communities we serve, and we recognize that diverse and inclusive teams lead to more innovation and better financial returns. We do not discriminate based on race, religion, color, national origin, gender, sexual orientation, age, marital status, veteran status, or disability status.
What is our hiring process?
Introductory Call with a member of our Talent Acquisition team.
First Interview with the up to 4 CivicPlus Team Members
Second Interview- Panel Interview with up to 4 CivicPlus Leaders
Interview Project Activity- This activity is designed to give us insight into your problem-solving approach and methods.
Offer
Please note that the specifics of this process may vary based on the position you're applying for.
Employment Practices
CivicPlus is proud to be an Equal Employment Opportunity employer. At CivicPlus, we celebrate and support diversity for the benefit of our employees, products, clients, and communities we serve.
Upon receiving an offer of employment, candidates must complete required pre-employment screenings, which include a drug test and background screen. Offer of employment is contingent upon this post-offer screening process. All testing will be conducted by a licensed independent administrator, which will follow testing standards and background screens in accordance with state law.
We are committed to providing equal employment opportunities to all qualified individuals and will make reasonable accommodations for individuals with disabilities during the interview process. If you require an accommodation, please let us know in advance so we can make appropriate arrangements. We welcome and encourage candidates of all abilities to apply for this position.",3.6,"CivicPlus
3.6",Remote,501 to 1000 Employees,1998,Company - Private,Computer Hardware Development,Information Technology,$25 to $100 million (USD)
3,Data Scientist,Employer Provided Salary:$60K - $140K,"We are looking for junior, mid-level or senior-level data scientists with the following:
Demonstrated software development experience with Python in a Unix environment.
Practical knowledge in Python Machine Learning and Data Visualization
Practical knowledge in Data ETL such as working with: Data loading from SQL, CSV, JSON, Excel, etc., Web scraping (Beautiful Soup, Scrapy, etc.) and Data Wrangling/Cleaning
Experience using the Unix command line.
Proficiency in statistical packages using any of the following: Python, R, STATA, SPSS, etc.
You’re Required To Have This
Looking for junior, mid and senior-level data scientists
Candidate may have some practical knowledge in these skill sets (not required, but helpful):
Using the Atlassian Tool Suite.
Continuous integration /continuous delivery (CI/CD)
Working knowledge with other object-oriented programming languages such as Java or C++
Working knowledge with Front-end data visualization libraries (i.e., D3.js; Raphael.js, etc.)
Experience with development of any of the following; Hadoop, Pig, MapReduce, or HDFS
Job Type: Full-time
Salary: $60,000.00 - $140,000.00 per year
Benefits:
401(k)
Dental insurance
Health insurance
Vision insurance
Schedule:
8 hour shift
Day shift
Monday to Friday
Experience:
Python: 1 year (Preferred)
SQL: 1 year (Preferred)
Work Location: Remote",-1,Tech brothers infoservices,Remote,Unknown,-1,Company - Public,-1,-1,Unknown / Non-Applicable
4,Data Scientist,Employer Provided Salary:$79K - $117K,"No Relocation Assistance Offered
# 154742 - Piscataway, New Jersey, United States
The data scientist is responsible for developing data-driven approaches and infrastructure to inform and accelerate product innovation, product design, and product development. This person will work with cross functional teams to gather, wrangle, cleanse, structure, and build models that are distributed to the greater R&D team and aligned with organizational goals. The role applies data analytics to enable new revenue-generating business models and improve underlying business processes for cost savings.

Responsbilities:
Write and implement custom code for web scraping, social media mining, and associated data ingestion and pre-processing
Write and implement custom code to extract data from internal systems and perform associated data engineering/cleansing
Develop, validate, and implement programmatic approaches for data visualization, descriptive statistical analysis, and predictive modeling.
Work with client teams to develop and implement custom solutions for decision-support services
Interface with IT to build and manage data warehouses for global use.
Support, train, and assist global R&D scientists via meetings, training sessions, and mentorship to aid the adoption of data analytics tools.
Write, refine, and manage python scripts for data analytics
Work with individuals throughout R&D to find key data sources, assess quality, and devise strategies for utilization
Work with current databases to build pipelines for manipulation, visualization, and descriptive/predictive modeling
Design data flows to extract data from organizational architecture and ETL into cloud architecture
Build data advanced visualizations including dashboards and custom javascript implementations
Support outside vendors and extract deliverables
Share knowledge with immediate data science team through regular presentations of progress, struggles, and advances
Assist in training R&D scientists on basic python skills
Required Skills and Qualifications:
Bachelor's Degree:Technical degree Preferably Computer Science
1-5 Years of Programming Experience with statistical computer language: Python, Julia, R, Java
Proficiency with SQL implementations (PostgreSQL, MySQL, Snowflake, BigQuery)
Proficiency with statistical concepts including descriptive analysis, experimental design, Bayesian statistics, sub-setting, and regression
Proficiency with statistical and data mining techniques including generalized linear model/regression, random forest, boosting, trees, text mining, social network analysis, dimensionality reduction algorithms
Preferred Skills and Qualifications:
Proficiency with machine learning techniques such as clustering, decision tree learning, naïve Bayes, support vector machines, Q-learning, temporal difference, adversarial networks, and neural networks
Proficiency with frameworks including TensorFlow, Theano, CNTK, scikit-learn, Caffe, Keras, Spark MLlib
Proficiency with distributed data/computing tools: Map/Reduce, Hadoop, Hive, Spark, Gurobi, etc
Visualizing and presenting data for stakeholders using: D3.js, plotly, seaborn, ggplot, etc
Ability to work with cloud data architectures
Excellent oral and written communication skills
Salary Range $79,000 - $116,550
Pay is based on several non-discriminatory factors including but not limited to experience, education, skills and office location. In addition to your salary, Colgate-Palmolive offers a performance based bonus and competitive benefits package.

Equal Opportunity Employer
Colgate is an equal opportunity employer and all qualified applicants will receive consideration for employment without regard to race, color, religion, gender, gender identity, sexual orientation, national origin, ethnicity, age, disability, marital status, veteran status (United States positions), or any other characteristic protected by law.
Are you interested in working for Colgate-Palmolive? You can apply online and attach all relevant documents such as a cover letter and resume or CV. Applications received by e-mail are not considered in the selection process. Become part of our team. We look forward to your application.
Colgate-Palmolive is a leading global consumer products company, tightly focused on Oral Care, Personal Care, Home Care and Pet Nutrition. Colgate sells its products in over 200 countries and territories around the world under such internationally recognized brand names as Colgate, Palmolive, elmex, Tom’s of Maine, Sorriso, Speed Stick, Lady Speed Stick, Softsoap, Irish Spring, Protex, Sanex, Elta MD, PCA Skin, Ajax, Axion, Fabuloso, Soupline and Suavitel, as well as Hill’s Science Diet and Hill’s Prescription Diet.
For more information about Colgate’s global business, visit the Company’s web site at http://www.colgatepalmolive.com. To learn more about Colgate Bright Smiles, Bright Futures® oral health education program, please visit http://www.colgatebsbf.com. To learn more about Hill's and the Hill’s Food, Shelter & Love program please visit http://www.hillspet.com. To learn more about Tom’s of Maine please visit http://www.tomsofmaine.com.
Reasonable accommodation during the application process is available for persons with disabilities. Please contact Application_Accommodation@colpal.com with the subject ""Accommodation Request"" should you require accommodation.",4.2,"Colgate-Palmolive
4.2","Piscataway, NJ",10000+ Employees,1806,Company - Public,Consumer Product Manufacturing,Manufacturing,$10+ billion (USD)
5,Sr. Business Data Analyst,Employer Provided Salary:$60.00 - $70.00 Per Hour,"Business Analysis Skills
Good Data analysis Skills
ANSI SQL proficiency working with DB technologies such as Azure SQL / Oracle
Problem solving skills
Excellent Communication Skills
Ability to elicit business requirements & packaging them into user stories
Documentation skills
Good Collaboration skills
Prior experience working in an Agile project team is a must
Experience using Azure boards is a plus (Jira or an equivalent platform is acceptable)
Backlog development / Backlog refinement / Sprint planning experience
Job Types: Full-time, Contract
Pay: $60.00 - $70.00 per hour
Experience level:
8 years
Schedule:
Monday to Friday
Overtime
Ability to commute/relocate:
Deerfield Beach, FL: Reliably commute or planning to relocate before starting work (Required)
Experience:
SQL: 5 years (Preferred)
Work Location: In person",4.6,"CTI Consulting
4.6","Deerfield Beach, FL",1 to 50 Employees,-1,Company - Private,-1,-1,$1 to $5 million (USD)
