,Job Title,Salary Estimate,Job Description,Rating,Company Name,Location,Size,Founded,Type of ownership,Industry,Sector,Revenue
41,Insurance Data Science Analyst (machine learning predictive models),$75K - $110K (Glassdoor est.),"IAT Insurance Group has an immediate opening for a Data Science Analyst to design, build, deploy, and support machine learning predictive models of critical data to key decision-makers to drive incremental value for the organization. The data science analyst will partner with teammates within the Analytics Group, the Information Technology Data Management, Analytics, and Actuarial teams. This is a great opportunity to create analytic solutions for multiple lines of business, deepen your insurance product knowledge and join a new and growing team within IAT to support the development of strategic data environments.
The role works a hybrid schedule from an IAT’s office in Newark or Jersey City, NJ. Other IAT locations or remote will be considered. The role will work from an IAT office Monday through Wednesday with the option of working remotely Thursday and Friday.

The ideal candidate will have at least two years of experience in an analytics, actuarial, or computer science role and at least one year of R/Python programming and data wrangling experience/coursework. To qualify, applicants must be authorized to work in the United States and must not require VISA sponsorship, now or in the future, for employment purposes.

To qualify, applicants must be authorized to work in the United States and
MUST NOT require VISA sponsorship, now or in the future, for employment purposes.
Responsibilities:
Create machine learning models, including sourcing data, training and validating the models, and assisting with deployment and monitoring.
Partner with Data Engineers, source and combine data from multiple source systems and formats (SQL server, flat files, json payloads, etc.)
Partner with Machine Learning Engineers, place models into production.
Leverage input from business partners, create and select features to add to models.
Leverage Python & SQL on the job.
Train, document, and present the predictive model.
Performs other duties as assigned.
If you choose to apply
please answer the questions to advocate for yourself and upload a resume
Qualifications:
Must-Have:
Bachelor’s degree in Data Science, Mathematics, Computer Science, Statistics, or a related field and two years of relevant experience or equivalent.
Equivalent is considered as having at least six years of hands-on experience in an analytics, actuarial, or a computer science role.
Can demonstrate an advanced skillset in Python, and familiarity with SQL. Advanced experience in R/C++/Java is also acceptable.
Core understanding of manipulating data sets (join, deduping, etc.)
Experience with traditional machine learning techniques such as GLMs, GBMs, ensembles.
Understanding of statistical modeling principles such as regression, classification, ensembling, regularization, and cross-validation.
Excellent oral and written communication and presentation skills, capable of presenting complex issues clearly, concisely, and persuasively to business and technical professionals.
Demonstrated initiative, self-starter with strong analytical and problem-solving skills.
To qualify, applicants must be authorized to work in the United States and must not require VISA sponsorship, now or in the future, for employment purposes.
Preferred to Have:
Master Degree
Actuarial or insurance experience
At least one year of R/Python programming and data wrangling experience/coursework.
Excellent understanding of data mining, predictive modeling, and data visualization.
Our Culture
IAT is the largest private, family-owned property and casualty insurer in the U.S. Insurance Answers Together® is how we define IAT, in letter and in spirit. We work together to provide solutions for people and businesses. We collaborate internally and with our partners to provide the best possible insurance and surety options for our customers. It’s about far more than being a workplace. We’re a work family.

At IAT, our fundamental belief is to a create a culture where all employees are heard and have a sense of belonging. Inclusion and Diversity are not just initiatives, it’s how we live. We’re committed to driving and building an open and supportive culture. By embracing the uniqueness of our employees, investing in their development, listening to, and engaging their ideas, we are stronger as an organization.

Our employees propel IAT forward – driving innovation, stable partnerships and growth. That’s why we continue to build an engaging workplace culture to attract and retain the best talent.

We offer comprehensive benefits like:
26 PTO Days (Entry Level) + 12 Company Holidays = 38 Paid Days Off
7% 401(k) Company Match and additional Profit Sharing
Hybrid work environment
Numerous training and development opportunities to assist you in furthering your career
Healthcare and Wellness Programs
Opportunity to earn performance-based bonuses
College Loan Assistance Support Plan (to help pay down an employee’s college loans)
Educational Assistance Program
Mentorship Program
Dress for Your Day Policy
All qualified applicants will receive consideration for employment without regard to race, color, religion, sex, sexual orientation, gender identity, national origin, disability, or status as a protected veteran. We maintain a drug-free workplace and participate in E-Verify.

Come join the IAT family!

IAT Recruiter:
Steve Morley | Senior Recruiter
steve.morley@iatinsurance.com
www.linkedin.com
If you choose to apply
please answer the questions to advocate for yourself and upload a resume",4.1,"IAT Insurance Group, Inc.
4.1","Newark, NJ",501 to 1000 Employees,1991,Company - Private,Insurance Carriers,Insurance,$1 to $5 billion (USD)
42,"Data Scientist, Expert",$129K - $179K (Glassdoor est.),"Requisition ID # 150867

Job Category: Accounting / Finance
Job Level: Individual Contributor
Business Unit: Operations - Other
Work Type: Hybrid
Job Location: Oakland; Alameda; Alta; American Canyon; Angels C& Antioch; Auberry; Auburn; Avenal; Avila Beach; Bakersfield; Balch C& Bear Valley; Belden; Bellota; Belmont; Benicia; Berkeley; Brentwood; Brisbane; Buellton; Burney; Buttonwillow; Calistoga; Campbell; Canyon Dam; Canyondam; Capitola; Caruthers; Chico; Clearlake; Clovis; Coalinga; Colusa; Concord; Concord; Corcoran; Cottonwood; Cupertino; Daly City; Danville; Davis; Dinuba; Downieville; Dublin; Emeryville; Eureka; Fairfield; Folsom; Fort Bragg; Fortuna; Fremont; French C& Fresno; Fresno; Fulton; Garberville; Geyserville; Gilroy; Goodyear; Grass Valley; Guerneville; Half Moon Bay; Hayward; Hinkley; Hollister; Holt; Houston; Huron; Jackson; Kerman; King City; Lakeport; Lemoore; Lincoln; Linden; Livermore; Lodi; Loomis; Los Banos; Lower Lake; Madera; Magalia; Manteca; Manton; Mariposa; Martell; Marysville; Maxwell; Menlo Park; Merced; Meridian; Millbrae; Milpitas; Modesto; Monterey; Montgomery Creek; Morgan Hill; Morro Bay; Moss Landing; Mountain View; Napa; Needles; Newark; Newman; Novato; Oakdale; Oakhurst; Oakley; Olema; Orinda; Orland; Oroville; Palo Alto; Palo Cedro; Paradise; Parkwood; Paso Robles; Petaluma; Pioneer; Pismo Beach; Pittsburg; Placerville; Pleasant Hill; Point Arena; Potter Valley; Quincy; Rancho Cordova; Red Bluff; Redding; Richmond; Ridgecrest; Rio Vista; Rocklin; Roseville; Round Mountain; Sacramento; Salida; Salinas; San Bruno; San Carlos; San Francisco; San Francisco; San Jose; San Luis Obispo; San Mateo; San Rafael; San Ramon; San Ramon; Sanger; Santa Cruz; Santa Maria; Santa Nella; Santa Rosa; Selma; Shaver Lake; Sonoma; Sonora; South San Francisco; Springville; Stockton; Storrie; Taft; Tracy; Turlock; Twain; Ukiah; Vacaville; Vallejo; Walnut Creek; Wasco; Watsonville; West Sacramento; Wheatland; Whitmore; Willits; Willow Creek; Willows; Windsor; Winters; Woodland; Yuba City

Department Overview
The aim of the Wildfire Data Science team in the Wildfire Risk Management organization is to enhance the risk practices of PG&E’s Electric Operation business and thereby address changing external conditions such as climate change. To this end the Wildfire Data Science team develops and maintains predictive models to enable PG&E to close the gap between metrics and electric system performance. These models provide a multi-layered view of risk across the electric system so that decision-making processes include and empower employees at all levels of the company to manage risk appropriately.

Position Summary
As part of the Wildfire Data Science team under the Wildfire Risk Management organization, the Expert Data Scientist designs, develops, and executes scripts, programs, models, algorithms, and processes, using structured and unstructured data from disparate sources and sizes to develop and deploy models quantifying the probability of failure for the electric distribution grid assets. This individual collaborates with a multi-disciplinary project team of data scientists, data engineers, and subject matter experts on technical development phases: data engineering, analytics/modeling, and visualization/user interface. This individual interacts with technical and non-technical clients to resolve analysis and technical issues and works with teams, clients, and senior leadership throughout the development cycle practicing continuous improvement. This role aims to quantify risk and develop tools to enable risk-informed planning and decision making for electric grid operations.
This position is hybrid, working from your remote office and your assigned work location based on business need. The assigned work location will be within the PG&E Service Territory.

PG&E is providing the salary range that the company in good faith believes it might pay for this position at the time of the job posting. This compensation range is specific to the locality of the job. The actual salary paid to an individual will be based on multiple factors, including, but not limited to, specific skills, education, licenses or certifications, experience, market value, geographic location, and internal equity. Although we estimate the successful candidate hired into this role will be placed towards the middle or entry point of the range, the decision will be made on a case-by-case basis related to these factors.

CA Minimum: $125,000
CA Maximum: $215,000

&/OR

Bay Minimum: $132,000
Bay Maximum: $226,000

This job is also eligible to participate in PG&E’s discretionary incentive compensation programs.

Job Responsibilities

Shares and collaborates with other PG&E data science professionals.
Works closely with domain experts to develop relevant domain knowledge in the electric and gas utility, as well as knowledge of related datasets.
Maintains and enhances data pipelines within the Palentir Foundry platform.
Works with business partners to advance business processes, based on analytical findings.
Applies machine learning and first principles modeling methods to develop robust and reliable analytical models, including visualizations, within the Palentir Foundry & AWS SageMaker platforms.
Documents data sources, methodology, and model evaluation metrics.
Serves as the technical lead for development of high complexity models.
Assesses business implications associated with modeling assumptions, inputs, methodologies, technical implementation, analytic procedures and processes, and advanced data analysis.
Works with sponsor departments and company subject matter experts to understand application and potential of modeling solutions that create value for end-users.
Presents findings and makes recommendations to senior management.

Qualifications

Minimum:
Bachelor’s Degree in Computer Science, Econometrics, Economics, Engineering, Mathematics, Applied Sciences, Statistics or job-related discipline or equivalent experience
Job-related experience, 8 years, OR Masters Degree and job-related experience, 6 years, OR Doctorate Degree and job-related experience, 3 years

Desired:
Graduate degree in Computer Science, Econometrics, Economics, Engineering, Mathematics, Applied Sciences, Statistics or job-related discipline
Relevant industry (electric or gas utility, renewable energy, analytics consulting, etc.) experience, 5 years
Experience collaborating on a data science team and conducting peer reviews of code and modeling work
Knowledge of a variety of machine learning techniques (clustering, decision tree learning, artificial neural networks, etc.) and their real-world advantages/drawbacks
Experience with the following programming languages: PySpark, Python, and SQL
Experience with Palantir Foundry, AWS SageMaker, and GitHub
Ability to synthesize complex information into clear insights and translate those insights into decisions and actions
Ability to clearly communicate complex technical details and insights to colleagues and stakeholders
Familiarity with electric distribution system equipment
Familiarity with Agile product management
Detail-oriented and meticulous about documentation",4.0,"PG&E Corporation
4.0","Oakland, CA",10000+ Employees,1905,Company - Public,Energy & Utilities,"Energy, Mining & Utilities",$10+ billion (USD)
43,Machine Learning Scientist,-1,"Strong Analytics is seeking Machine Learning Scientists to help design and develop machine-learning based solutions for clients ranging from startups to Fortune 500s. ML Scientists are core contributors at Strong, with responsibilities such as building data analysis pipelines, designing/training/validating machine learning models and algorithms, and collaborating with colleagues and clients on state-of-the-art research. The ideal candidate is proficient in Python and/or R, SQL, and has prior experience working on ML solutions from concept to production.

At Strong, your work will have an immediate impact on clients addressing real world challenges. Our work spans industries such as manufacturing, gaming, agriculture, automotive, and healthcare, among others. We pride ourselves not only in building the right solutions for our clients through research and development, but in implementing and scaling up those solutions through strong engineering. This role thus requires a deep expertise in applying data science and machine learning to real-world problems where data must be gathered, transformed, cleaned, and integrated into a larger architecture.
Responsibilities
Work with other machine learning scientists and engineers to develop custom ML solutions for a variety of industries and use cases
Develop, train, and validate machine learning algorithms
Apply techniques such as classification, clustering, regression, NLP, deep learning (CNN, RNN, GANs), time series forecasting, and Bayesian methods to build scalable solutions
Help create generalized solutions out of specific use cases
Help identify areas of opportunity and improvement within projects
Research new techniques and technologies in the space of ML and AI, and evaluate their potential for business use cases
Collaborate in a fully remote, Agile-like environment using tools like Slack and Git (with a lot of uninterrupted development time)
We offer a comprehensive compensation package, including:

Competitive salary
100%-covered Health insurance for employees, 75%-covered dependents
Four weeks PTO
401(k) with employer contribution matching
Personalized monthly perks with matched charitable donations
A 100% remote work environment with highly protected work/life balance

Applicants must reside in either the US or Canada. All applicants will be considered based on their experience and demonstrated skill/aptitude, not formal education. Candidates will be evaluated based on their experience in the following areas:
Statistical modeling and hypothesis testing
Designing, training, and validating results from a breadth of machine learning algorithms
Writing clean, efficient SQL
Building and testing Python applications
Building deep neural networks with modern tools, such as PyTorch or Tensorflow
Collaborating via Git
Applicants should have the ability to travel infrequently (<5% of your time) for team meetings, conferences, and occasional client site visits.",5.0,"Strong Analytics
5.0",Remote,1 to 50 Employees,-1,Company - Private,Business Consulting,Management & Consulting,Unknown / Non-Applicable
44,Data Science Code reviewer,-1,"At TripleTen, we're building an international family of digital re-skilling products to help people with versatile backgrounds learn a new profession and build a sustainable career in tech. Our program graduates have landed jobs at top companies like Tesla, Spotify, PlayStation, Google, and Microsoft. So far, over 5,000 students have chosen TripleTen, and hundreds of new students are joining us each month. We believe everyone can jumpstart a new career, which is why we produce quality educational content and offer intensive courses in tech complete with full access to an interactive platform, code reviews, and support from industry practitioners.
What we're looking for
For the Data Science and Data Analysis programs, we are looking for an experienced data scientist to review our students and help them successfully become professionals.

Requirements:


Proficient English, Indonesian languages;
Experience working as an analyst using Python;
Experience working with machine learning projects for more than a year;
Familiar with the Pandas, NumPy, Matplotlib, Sklearn libraries;
Readiness to dedicate at least 10 hours a week to review the student code.

What you will do::

You will check the student code and provide feedback. Further, it's your responsibility to decide whether or not to grant credit for their assignments. This person will also provide advice on improving the code, note any inaccuracies, and point out errors.

What we can offer you::


Training in code review and communication techniques;
The ability to work while performing your primary job;
Sharing experience with professionals in our community;
Cross-cultural work experience in mentoring and conducting webinars;
Competitive payment which depends on the number of checked tasks.",-1,TripleTen,Idaho,51 to 200 Employees,-1,Company - Private,-1,-1,Unknown / Non-Applicable
45,Data Analyst Senior - Power BI,$82K - $107K (Glassdoor est.),"CLA is a top 10 national professional services firm where our purpose is to create opportunities every day, for our clients, our people, and our communities through industry-focused wealth advisory, digital, audit, tax, consulting, and outsourcing services. Even with more than 8,500 people, 130 U.S. locations, and a global reach, we promise to know you and help you.
CLA is dedicated to building a
culture
that invites different beliefs and perspectives to the table, so we can truly know and help our clients, communities, and each other.
About the role:
CLA is looking to hire a Data Analyst Senior; you will make use of the Microsoft Power Platform, or a scripting language like R or Python. The Data Analyst Senior cleans up data for analysis and/or visual display in a report or dashboard, or they work out details regarding data access to support a project. Our Data Analysts favorite tools are the Power Platform (Power Apps/Power BI/Power Automate), Excel, DAX, M, R, and Alteryx. In contrast to an Associate, the Senior will develop more autonomy to develop solutions and may lead others, take on administrative tasks, perform support roles, and get involved in new business development.
As a Data Analyst Senior, you will:
Service Specialization: Develop service specific knowledge through greater exposure to peers, internal experts, clients, regular self-study, and formal training opportunities. Gain exposure to a variety of client situations to develop business skills. Retain knowledge gained and performance feedback provided to transfer into future work. Approach all problems and projects with a high level of professionalism, objectivity and an open mind to new ideas and solutions.
Data Analysis: Participate in the collection and analysis of data using a variety of data tools. Together with the Data Analytics team, support the building and implementing of solutions for external clients and internal projects. Assess the effectiveness and accuracy of new data sources and data gathering techniques.
Data Development: Working under the guidance of Data Analytics team leaders to develop custom data models and algorithms to apply to data sets. Develop predictive analytics, machine learning, and artificial intelligence techniques. Use existing processes and tools to monitor and analyze solution performance and accuracy and communicate findings to team members.
Collaboration: Work individually as well as in collaboration with others. Interaction with others will primarily be virtual with leadership and colleagues from other offices. Take on additional roles beyond technical development and client service that may include: serving as primary contact with clients or business leaders on internal projects, take on administrative tasks, perform support roles, and get involved in new business development.
What you will need:
3 plus years of experience in data analytics
2 years' experience as a Power BI Developer
Bachelor’s Degree in computer science or related field
Education
Bachelor’s Degree in computer science or related field, or equivalent combination of education and work experience.
Our Perks:
Flexible PTO (designed to offer flexible time away for you!)
Up to 12 weeks paid parental leave
Paid Volunteer Time Off
Mental health coverage
Quarterly Wellness stipend
Fertility benefits
Complete list of benefits
here
#LI-JH1
Equal Opportunity Employer /AA Employer/Minorities/Women/Protected Veterans/Individuals with Disabilities.

Wellness at CLA
To support our CLA family members, we focus on their physical, financial, social, and emotional well-being and offer comprehensive benefit options that include health, dental, vision, 401k and much more.
To view a complete list of benefits click
here
.",3.9,"CliftonLarsonAllen
3.9","Madison, WI",5001 to 10000 Employees,1953,Company - Private,Accounting & Tax,Financial Services,$500 million to $1 billion (USD)
