,Job Title,Salary Estimate,Job Description,Rating,Company Name,Location,Size,Founded,Type of ownership,Industry,Sector,Revenue
63,"Data Scientist, Data Strategy and Analytics",Employer Provided Salary:$136K - $272K,"Abbott is a global healthcare leader that helps people live more fully at all stages of life. Our portfolio of life-changing technologies spans the spectrum of healthcare, with leading businesses and products in diagnostics, medical devices, nutritionals and branded generic medicines. Our 115,000 colleagues serve people in more than 160 countries.
About Abbott
Abbott is a global healthcare leader, creating breakthrough science to improve people’s health. We’re always looking towards the future, anticipating changes in medical science and technology.
Working at Abbott
At Abbott, you can do work that matters, grow, and learn, care for yourself and family, be your true self and live a full life. You’ll also have access to:
Career development with an international company where you can grow the career you dream of.
Free medical coverage for employees* via the Health Investment Plan (HIP) PPO
An excellent retirement savings plan with high employer contribution
Tuition reimbursement, the Freedom 2 Save student debt program and FreeU education benefit - an affordable and convenient path to getting a bachelor’s degree.
A company recognized as a great place to work in dozens of countries around the world and named one of the most admired companies in the world by Fortune.
A company that is recognized as one of the best big companies to work for as well as a best place to work for diversity, working mothers, female executives, and scientists.
The Opportunity
This position works out of our Alameda, CA or Delkenheim, DE locations in the Abbott Diabetes Care (ADC) division where we're focused on helping people with diabetes manage their health with life-changing products that provide accurate data to drive better-informed decisions. We’re revolutionizing the way people monitor their glucose levels with our new sensing technology.
As the first Data Scientist for the Global Strategic Marketing group, you will shape the direction of data science and data strategy at ADC and will:
Design, validate, and solve strategic questions addressing business opportunities across the organization using data sources using a wide variety of structured and unstructured data sources such as app utilization data, customer contacts, sales performance, and secondary analytics on market performance
Focus on developing hypotheses and employ a diverse toolkit of rigorous analytical approaches, different methodologies, frameworks, and technical approaches to test them
Manage the creation of mathematical models to deliver business value by leveraging statistical practices, operations research techniques, and data analysis
Coordinate efforts with cross functional divisions and strategic business partners to design systems that support analysis
This role is strategic in nature, and as such will work closely with key stakeholders to assure continuous evolvement of data science and actionable analytics at ADC. A candidate for this position would be well versed in programming, mathematics, statistics, data modeling, and have strong business acumen. The ability to work in a diverse team and willingness to learn will be key attributes in the role. Finally, you have the opportunity to help millions of people with diabetes globally through learnings from structured and unstructured data sets that exist in our organization.
What You’ll Work On
Create data-driven stories that address strategic business questions, supported by strong analytical skills with a solid foundation in programming (e.g. R, python), database environment (e.g. big-data platforms, SQL), and dashboard development (e.g. PowerBI)
Work cross-functionally to design systems that will support deep analysis
Define and implement a clear data science and analytics roadmap for the division, with proven ability to influence cross-functionally in order to materially impact the business
Design, create, test, and implement complex models and algorithms that drive analytical solutions throughout the organization
Conduct advanced statistical and other analysis to provide actionable insights, identify trends, and measure performance
Collaborate with technical translators and understand business opportunities to implement scalable and sustainable solutions
Collaborate with other teams to develop novel ways of meeting business objectives utilizing cutting-edge technologies and tools and disseminate best practices
Stay abreast of developments at the intersection of data science, technology, and business relevant to the company and drive business innovation through analytics
Effectively communicate the analytics approach and how it will meet and address objectives to business partners
Required Qualifications
Bachelor's degree in Mathematics, Statistics, related technical field, or equivalent practical experience.
8+ years of relevant experience in the biological data analytics/science in a relevant industrial or academic setting.
Preferred Qualifications
10+ years of experience in analytics
Strong understanding of data analytics, structured and unstructured data analysis, predictive modeling techniques, and data visualization as well as a good command of emerging methodologies like artificial intelligence
Experience with data querying languages (e.g. SQL), scripting languages (e.g. Python), and/or statistical/mathematical software (e.g. R) plus reporting tools such as PowerBI, SAP BI
Experience engaging cross-functional teams to build a strong data infrastructure
A recognized thought leader and innovator in the development of new tools, methodologies, and problem-solving approaches
Broad understanding of the latest data science, analytics, and technology trends and their impact on business strategies and operations
Curiosity-driven, with mindset geared towards continuous learning. Must be comfortable with ambiguity with a proven track record of being a self-starter.
Outstanding communication skills, particularly in conveying complex technical concepts to non-technical audiences such as clients, team members and senior executives.
Ability to travel / work in Europe and other countries for extensive periods when needed (initially 1-3 months at a time; longer-term settling to 10%)
MSc/PhD ideally in Computer Science, Mathematics, Statistics, Engineering, or similar technical disciplines/experience
Good understanding of AWS tools such as Athena, Sagemaker, Comprehend
Good understanding of data pipelines such as data transfer methods, API documentation
Experience with large-scale A/B testing systems, especially in the domain of online advertising
Apply Now
Participants who complete a short wellness assessment qualify for FREE coverage in our HIP PPO medical plan. Free coverage applies in the next calendar year.
Learn more about our health and wellness benefits, which provide the security to help you and your family live full lives: www.abbottbenefits.com
Follow your career aspirations to Abbott for diverse opportunities with a company that can help you build your future and live your best life. Abbott is an Equal Opportunity Employer, committed to employee diversity.
Connect with us at www.abbott.com, on Facebook at www.facebook.com/Abbott and on Twitter @AbbottNews and @AbbottGlobal.

The base pay for this position is $135,700.00 – $271,500.00. In specific locations, the pay range may vary from the range posted.",3.8,"Abbott Laboratories
3.8","Alameda, CA",10000+ Employees,1888,Company - Public,Health Care Services & Hospitals,Healthcare,$10+ billion (USD)
64,Machine Learning Data Scientist,Employer Provided Salary:$180K - $250K,"Machinify is a revolutionary healthcare software company with a mission to ensure that patients get the right medical treatment, at the right time, at the right price. Our cloud-based Machinify AI platform leverages the latest advances in machine learning, large language models, data analytics, and cloud processing to solve previously intractable problems, transforming healthcare administration and payment operations.
Our team has deployed models that check for anomalies in medical claims, predict the trajectory of care of a particular patient and the next likely treatment and even “read and understand” medical record documents using state-of-the-art NLP and computer vision techniques to assist clinicians. There are many more such problems to be solved. So if you are looking for a place where you can apply your expertise in AI/ML to solve real problems and make a difference in an industry that impacts millions of lives while accelerating your career, you’ll love Machinify. We are seeking a Sr Machine Learning Scientist to join our team.
What you’ll do:
Advance Machinify’s capabilities to model and understand medical decisions which will power a range of products in the claims processing space.
Make thoughtful decisions around which methods/algorithms are likely to work well in solving the business problem at hand
Consider the quality of the available input data and build robust systems that will work well in the presence of noise/errors
Measure the model output in practical real-world settings and iterate your approach
Learn about the healthcare industry and become an expert over time
What You Bring:
You enjoy solving real-world business problems involving data-driven optimization and ML modeling - and have been doing that successfully for a while.
You are comfortable measuring and optimizing the direct business impact of work.
You are interested in learning about the healthcare industry and helping us improve the care millions of people receive.
You are scrappy, and love solving hard problems that matter.
You are experienced with SQL, handling large-scale data, and are comfortable with at least one programming language (Python, R, etc.).
You have experience building ML models using modern ML approaches like Neural Nets or Tree-ensembles from scratch for new applications - making decisions relating to which supervised labels to use, the metric to optimize for, and the features likely to be useful.
You are a critical thinker who can be strategic without losing attention to detail.
You are comfortable taking the initiative and owning projects from start to finish.
You can build positive relationships based on trust and value delivered.
The base salary for this position will vary based on an array of factors unique to each candidate such as qualifications, years and depth of experience, skill set, certifications, etc. The base salary range for this role is $180k-250k. We are hiring for different seniorities, and our Recruiting team will let you know if you qualify for a different role/range. Salary is one component of the total compensation package, which includes meaningful equity, excellent healthcare, flexible time off, and other benefits and perks.
Equal Employment Opportunity at Machinify
Machinify is committed to hiring talented and qualified individuals with diverse backgrounds for all of its positions. Machinify believes that the gathering and celebration of unique backgrounds, qualities, and cultures enriches the workplace.",3.7,"Machinify
3.7",California,51 to 200 Employees,2016,Company - Private,Software Development,Information Technology,Unknown / Non-Applicable
65,Data Scientist,Employer Provided Salary:$61K - $106K,"Responsibilities:
Data Science Solution Delivery:
Contribute to the agile delivery of business partner strategic roadmaps using best practice data science methods, frameworks, and governance processes
Data Science Domain:
Collaborate with IT and business partners to define, manage and deliver innovative data science solutions to drive growth and adoption of capabilities at Hershey
Data Science Advocacy:
Evangelize future data science solutions identified by Enterprise Data leadership, including innovations such as: machine learning, statistical modeling, feature discovery/selection, optimization, exploratory data analysis, data mining and pattern recognition
Lead and coordinate key cross-functional data science efforts to accelerate value creation for agile execution team outcome delivery through machine learning and other AI algorithms
As part of a team, use machine learning (ML), deep learning (DL) and other analytical techniques to create scalable solutions for business problems
Interact with business partners, technologists and engineers define and understand business problems, help, and aid them to implement ML/DL algorithms when appropriate
Using best practice guidance from the Enterprise Data team, oversee the health and evolution of agile execution team data science technologies
Able to articulate the holistic benefits of data science from a business perspective, while maintaining the relationship with business analysts, data architects, technical engineers, and project managers
Minimum knowledge, skills and abilities required to successfully perform major duties/responsibilities:
Working knowledge of agile frameworks
Ability to manage multiple priorities, meet deadlines and produce quality results under pressure
Demonstrated leadership and managerial skills
Strong problem solving and analytical skills
Strong team player, change agent, and advocate
Excellent customer service skills
High energy self-starter
Excellent verbal and written communication skills
Desired Qualifications
a. Education: minimum Master’s degree majoring in industrial systems engineering, mathematics and/or other engineering domains with strong Operations Research (OR) background; PhD preferred
b. Extensive experience with tech stacks like Python, databricks, Solvers (CPlex, Gurobi, OR-Tools, etc.), Snowflake
c. Demonstrated expertise in optimization algorithms like linear programming (LP); integer programming (IP); mixed integer program (MIP); and other optimization problems
d. Working knowledge with modern cloud-based data storage and compute environments (e.g., Snowflake, Databricks in Azure, etc.)
e. Excellent communication and presentation skills, with the ability to articulate new ideas and concepts to technical and non-technical partners
Nice to have:
a. Experience with Agile delivery
b. Experience deploying ML models into discovery/production environment to drive insights using MLOps a plus
c. Experience of building/deploying Machine learning models like forecasting and market mix models in retail and/or CPG
Job Type: Contract
Pay: $60,875.61 - $106,279.78 per year
Experience:
Python: 1 year (Preferred)
SQL: 1 year (Preferred)
Work Location: Remote",2.9,"AppsIntegration.Inc
2.9",Remote,1 to 50 Employees,-1,Company - Private,Computer Hardware Development,Information Technology,$1 to $5 million (USD)
66,"Data Scientist, Analytics",Employer Provided Salary:$150K - $175K,"About Us:
At Parafin, our mission is to grow small businesses. Small businesses are the backbone of our economy, yet banks do not have their back. Parafin is a technology company that builds infrastructure which enables small businesses to get easy access to financial services via platforms they sell on.

Parafin's first product offers capital-as-a-service for online platforms. Parafin currently powers the capital programs of platforms ranging from Series B to post-IPO companies such as DoorDash, Amazon, and Worldpay. We are a tight-knit team of engineers and designers, coming from organizations such as Stripe, Square, Plaid, Coinbase, Robinhood, Affirm, Uber, and CERN, and are excited both about helping hundreds of thousands of small businesses grow and thrive, and building products that leaders at top companies have started to use every day.

We are backed by prominent venture capitalists such as Ribbit Capital, Thrive Capital, GIC, Index Ventures, Green Oaks Capital, and SV Angel.
What You’ll Be Doing:
You will solve business problems through analysis, metric development, and modeling.
You will make efficient, timely use of data to guide product and business decisions.
You will define and conduct experiments impacting core business processes.
You will build data sets, models, and visualizations that enable the entire company to prioritize and operate.
You will analyze conversion on our product and identify first-order product improvements.
What We’re Searching For:
You are an effective generalist who partners well with engineering, product, and business functions.
You communicate very well with both technical and non-technical partners.
You care deeply about the quality and correctness of your work.
You are comfortable managing competing and shifting priorities.
You are excited about working on a small team.
You have at least two years of work experience as a data scientist in an analytics role.
You are experienced with Python and comfortable with SQL
You have a bachelor's degree in statistics, engineering, math, computer science, or a related technical discipline.
We Prefer If You Have:
Experience measuring and optimizing human-in-the-loop processes
Experience partnering with operations teams
Experience with financial products and credit risk
Experience with SQL
Graduate degree
What We Offer
Salary Range: $150-$175k
Equity grant
Medical, dental & vision insurance
Unlimited PTO & work from home flexibility
Commuter benefits
Free lunches
Paid parental leave
401(k)
Employee assistance program
If you require reasonable accommodation in completing this application, interviewing, completing any pre-employment testing, or otherwise participating in the employee selection process, please contact us.",4.6,"Parafin
4.6","San Francisco, CA",51 to 200 Employees,2020,Company - Private,Financial Transaction Processing,Financial Services,Unknown / Non-Applicable
67,Equity Quantitative Research | Equity Model Research | Quantitative Researcher,Employer Provided Salary:$175K - $300K,"Job Description
Business: Equity Quantitative Research (EQR)
Title: Quantitative Researcher, Equity Model Research (EMR)
Location: New York
About Citadel
Citadel’s ambition is to be the most successful investment firm of all time. We manage capital on behalf of many of the world’s preeminent private, public and nonprofit institutions. We strive to identify the highest and best uses of capital to generate superior long-term returns for the world’s preeminent public and private institutions. For over 30 years, Citadel has cultivated a culture of learning and collaboration among some of the most talented and accomplished investment professionals, researchers and engineers in the world. Our colleagues are empowered to test their ideas and develop commercial solutions that accelerate their growth and drive real impact.
About Equity Quantitative Research
Equity Quantitative Research (EQR) sits at the intersection of fundamental investment approach and quantitative rigor and discipline. Teams of quantitative researchers and developers work together to build and scale one of the largest equities portfolios in the market by optimizing various aspects of the investment, risk management, portfolio construction, and trade execution lifecycle. EQR’s teams are small and highly collaborative – each member makes meaningful contributions to the research agenda and direction, and has visible impact in Citadel’s investments.
Equity Model Research
The Equity Model Research team (EMR) is responsible for the tools and analytics required for portfolio construction, risk management, and hedging of Citadel’s equities portfolios. The customized risk models and hedging framework developed by EMR are central to Citadel’s ability to manage our business and provide a competitive advantage to our investment teams.
Responsibilities
Research portfolio construction and optimization in the context of large complex equity portfolios

Apply cutting edge computational techniques and statistical methods to solve complex problems

Build proprietary risk models for both fundamental and quant equity long-short strategies

Develop econometric and mathematical models to define stress scenarios and estimate the statistical properties of drawdowns

Leverage economic models and financial analysis to define fundamental factors driving the cross-section of stock returns

Engage with a variety engineering and research teams to implement analytics in production

Work closely with Portfolio Managers and Risk Managers to understand and incorporate risk metrics and methodologies within the investment process

Stay up to date on the latest academic and industry research and challenge yourself to continually improve and challenge the way things are done

Explore new and alternative data sources while developing a deep understanding of financial markets

Requirements
Bachelors, Masters, or Ph.D. in Statistics, Mathematics, Operations Research, Economics or a related field

Advanced training in Statistics, Mathematics, Finance/Financial Engineering or a related field

Strong mathematical and/or statistical modeling background

Demonstrated empirical skill; comfortable with analysis of large datasets

Intellectual curiosity and passion for solving investment problems through the use of technology and fundamentals

Demonstrated interest in or knowledge of investments, including asset pricing, empirical anomalies and market microstructure

Previous exposure to a quantitative research role with exposure to equity factor models preferred

Experience using statistical packages (e.g. Matlab, R) and experience with programming & scripting languages (e.g. Python, C/C++)

In accordance with New York City’s Pay Transparency Law, the base salary range for this role is $175,000 to $300,000. Base salary does not include other forms of compensation or benefits.
About Citadel
Citadel is one of the world’s leading alternative investment managers. We manage capital on behalf of many of the world’s preeminent private, public and nonprofit institutions. We seek the highest and best use of investor capital in order to deliver market leading results and contribute to broader economic growth. For over 30 years, Citadel has cultivated a culture of learning and collaboration among some of the most talented and accomplished investment professionals, researchers and engineers in the world. Our colleagues are empowered to test their ideas and develop commercial solutions that accelerate their growth and drive real impact.",3.9,"Citadel Enterprise Americas
3.9","New York, NY",1001 to 5000 Employees,1990,Company - Private,Investment & Asset Management,Financial Services,$25 to $100 million (USD)
